{
  "$schema": "https://apps.humation.app/schema/app.schema.json",
  "name": "とんとん (Tonton)",
  "tagline": "Log what each of you paid and always know who owes whom",
  "description": "Tonton is a shared expense tracker for couples living together in Japan. Each person logs what they paid, picks a category and adjusts the split, and the home screen keeps one number in view: who owes whom, and how much. Settle up whenever you like and the balance resets to zero.\n\nRecurring costs such as rent and utilities post themselves each month, receipts are read on the device with the camera, and a monthly report turns the breakdown into a square card you can share. A pair links by invite code, and both phones stay in sync.\n\nBoth partners are hand-drawn Humation avatars. Each person builds their own in the icon editor, choosing hair, skin, outfit and accessory parts and a color for each; the app stores the part IDs and hex colors and composes the avatar on the device from the humation-1 asset set. The avatars mark who paid on every row of the history, stand on either side of the split card when you add an expense, appear on the home balance card and in the settings, and head the monthly share image.",
  "url": "https://tontonjp.com",
  "category": "lifestyle",
  "platforms": ["ios"],
  "pricing": "freemium",
  "humation": {
    "packages": ["@humation/assets-humation-1"],
    "usage": "Both partners' icons: every history row, the split card when adding an expense, the home balance card, the settings profiles and the monthly share image"
  },
  "developer": {
    "name": "koachan",
    "github": "koachan-dev",
    "url": "https://www.koachan.dev/"
  },
  "icon": "icon.png",
  "screenshots": [
    { "file": "screenshots/01-avatar-builder.png", "alt": "The icon editor with hair colors, skin tones and hairstyle options below a live preview of the hand-drawn avatar" },
    { "file": "screenshots/02-add-expense.png", "alt": "Adding an expense: both partners' avatars mark who paid, and the split card shows what each one owes" },
    { "file": "screenshots/03-home.png", "alt": "The home screen with a settle-up card showing both avatars and the amount one partner owes the other" },
    { "file": "screenshots/04-history.png", "alt": "The history list, where a small avatar beside every expense shows which partner paid for it" },
    { "file": "screenshots/05-share-card.png", "alt": "The monthly share card with both avatars, a category donut chart and the totals for the month" }
  ],
  "links": {
    "appStore": "https://apps.apple.com/jp/app/id6760719046",
    "x": "https://x.com/koachandev"
  },
  "i18n": {
    "ja": {
      "tagline": "ふたりの支払いを記録して、立て替えをいつでも把握",
      "description": "Tonton は、日本で一緒に暮らすカップルのための支払い共有アプリです。それぞれが払ったものを記録し、カテゴリを選んで負担の割合を調整すると、ホーム画面には「どちらがいくら立て替えているか」という一つの数字だけが表示されます。好きなタイミングで精算すれば、残高はゼロに戻ります。\n\n家賃や光熱費のような毎月の固定費は自動で登録され、レシートは端末のカメラで読み取れます。月次レポートは内訳を正方形のカードにまとめてくれるので、そのままシェアできます。ペアは招待コードでつながり、2 台のスマホの内容はいつも同期されています。\n\nふたりのアイコンは、それぞれ手描きの Humation アバターです。アイコンエディターで髪・肌・服・アイテムのパーツと色を選んで作ると、アプリはパーツ ID と色の HEX 値だけを保存し、humation-1 アセットセットから端末上でアバターを組み立てます。アバターは履歴の各行で誰が払ったかを示し、支出を追加するときの割り勘カードの両側に立ち、ホームの残高カードや設定にも表示され、月次のシェア画像の顔にもなります。",
      "usage": "ふたりのアイコン。履歴の各行、支出追加時の割り勘カード、ホームの残高カード、設定のプロフィール、月次のシェア画像",
      "screenshots": [
        {
          "file": "screenshots/01-avatar-builder.png",
          "alt": "手描きアバターのライブプレビューの下に、髪の色・肌の色・髪型の選択肢が並ぶアイコンエディター"
        },
        {
          "file": "screenshots/02-add-expense.png",
          "alt": "ふたりのアバターで誰が払ったかを示し、割り勘カードにそれぞれの負担額が出る支出の追加画面"
        },
        {
          "file": "screenshots/03-home.png",
          "alt": "ふたりのアバターと、片方がもう片方に払う金額を示す精算カードがあるホーム画面"
        },
        {
          "file": "screenshots/04-history.png",
          "alt": "支出ごとに小さなアバターが付いて、どちらが払ったかわかる履歴一覧"
        },
        {
          "file": "screenshots/05-share-card.png",
          "alt": "ふたりのアバター、カテゴリ別のドーナツグラフ、月の合計が載った月次シェアカード"
        }
      ]
    }
  },
  "addedAt": "2026-09-05"
}
