{
  "$schema": "https://apps.humation.app/schema/app.schema.json",
  "name": "simrip",
  "tagline": "Plan itineraries, packing, bookings, and expenses without signing up",
  "description": "simrip is an iPhone and iPad travel planning app for organizing domestic and international itineraries without signing up. Keep local dates, time zones, packing lists, booking notes, and expenses together for each trip.\n\nHumation avatars appear in Edit together to identify the owner and other participants.",
  "url": "https://simrip.app/en/",
  "category": "lifestyle",
  "platforms": ["ios"],
  "pricing": "freemium",
  "humation": {
    "packages": ["@humation/core", "@humation/assets-humation-1"],
    "usage": "Participant avatars in Edit together"
  },
  "developer": {
    "name": "SAKURAKO AYABE",
    "github": "pipkchu"
  },
  "icon": "icon.png",
  "screenshots": [
    {
      "file": "screenshots/01-home.webp",
      "alt": "simrip home screen with sample itinerary and create trip actions"
    },
    {
      "file": "screenshots/02-itinerary.webp",
      "alt": "Sample trip itinerary arranged by day and time"
    },
    {
      "file": "screenshots/03-packing.webp",
      "alt": "Packing checklist with categories, completed items, and reorder controls"
    },
    {
      "file": "screenshots/04-expenses.webp",
      "alt": "Trip expenses screen showing the sample total and one itinerary expense"
    },
    {
      "file": "screenshots/05-collaboration.webp",
      "alt": "Collaboration screen with Humation avatars and participant roles"
    }
  ],
  "links": {
    "appStore": "https://apps.apple.com/jp/app/id6780345249"
  },
  "i18n": {
    "ja": {
      "tagline": "登録なしで旅程・持ち物・予約・費用をひとまとめに",
      "description": "simrip は、会員登録なしで使える iPhone・iPad 向けの旅行計画アプリです。国内・海外を問わず、現地の日付とタイムゾーン、持ち物リスト、予約のメモ、費用を旅ごとにまとめて管理できます。\n\nHumation アバターは「Edit together」で使われていて、旅のオーナーとほかの参加者を見分けるのに役立ちます。",
      "usage": "Edit together に表示される参加者のアバター",
      "screenshots": [
        {
          "file": "screenshots/01-home.webp",
          "alt": "サンプルの旅程と、旅を作成するボタンが並ぶ simrip のホーム画面"
        },
        {
          "file": "screenshots/02-itinerary.webp",
          "alt": "日付と時刻ごとに並んだサンプルの旅程"
        },
        {
          "file": "screenshots/03-packing.webp",
          "alt": "カテゴリ分けと完了チェック、並べ替えができる持ち物リスト"
        },
        {
          "file": "screenshots/04-expenses.webp",
          "alt": "サンプルの合計と、旅程に紐づく費用 1 件を表示した費用画面"
        },
        {
          "file": "screenshots/05-collaboration.webp",
          "alt": "Humation アバターと参加者の役割が並ぶ共同編集の画面"
        }
      ]
    }
  },
  "addedAt": "2026-09-03"
}
