{
  "$schema": "https://apps.humation.app/schema/app.schema.json",
  "name": "Humation",
  "tagline": "Design your own hand-drawn avatar",
  "description": "Humation is a hand-drawn avatar creator. Pick a hairstyle, outfit, accessory and colors, or roll a random one from a seed, and download it as SVG or PNG for any profile picture.\n\nEvery avatar is drawn locally from the Humation 1 asset set, so it looks the same everywhere it is used.",
  "url": "https://humation.app/avatar",
  "category": "lifestyle",
  "platforms": [
    "web"
  ],
  "pricing": "free",
  "humation": {
    "packages": [
      "@humation/core",
      "@humation/react",
      "@humation/assets-humation-1"
    ],
    "usage": "The creator canvas and every part preview"
  },
  "developer": {
    "name": "Humation Labs",
    "github": "humation-labs",
    "url": "https://humation.app"
  },
  "icon": "icon.png",
  "screenshots": [
    {
      "file": "screenshots/01.png",
      "alt": "The avatar creator with a live preview and the Head part picker"
    },
    {
      "file": "screenshots/02.png",
      "alt": "Choosing an outfit in the Body tab"
    },
    {
      "file": "screenshots/03.png",
      "alt": "Adding an item or a cat companion in the Item tab"
    },
    {
      "file": "screenshots/04.png",
      "alt": "The Colors sheet for stroke, hair, skin, cloth and background"
    }
  ],
  "links": {
    "repo": "https://github.com/humation-labs/humation"
  },
  "i18n": {
    "ja": {
      "tagline": "手描きのアバターを、自分でデザイン",
      "description": "Humation は、手描きタッチのアバターを作れるアバタークリエイターです。髪型・服・アイテム・色を選ぶか、シードからランダムに生成して、SVG か PNG でダウンロード。どんなサービスのプロフィール画像にも使えます。\n\nすべてのアバターは Humation 1 アセットセットからその場で描画されるので、どこで使っても同じ見た目になります。",
      "usage": "クリエイターのキャンバスと、各パーツのプレビュー",
      "screenshots": [
        {
          "file": "screenshots/01.png",
          "alt": "ライブプレビューと Head タブのパーツ一覧が並ぶアバタークリエイター"
        },
        {
          "file": "screenshots/02.png",
          "alt": "Body タブで服を選んでいるところ"
        },
        {
          "file": "screenshots/03.png",
          "alt": "Item タブでアイテムや相棒の猫を追加しているところ"
        },
        {
          "file": "screenshots/04.png",
          "alt": "線・髪・肌・服・背景の色を決める Colors シート"
        }
      ]
    }
  },
  "addedAt": "2026-09-02"
}
