{
  "$schema": "https://apps.humation.app/schema/app.schema.json",
  "name": "DopaDopa",
  "tagline": "Quick two-player board games with friends, online or on one phone",
  "description": "DopaDopa is a collection of short two-player board games for iPhone: Tic-Tac-Toe, Connect 4, Quoridor, Hex, Hit & Blow, Yacht, Hare and Hounds and a word game. Share a six-digit room code or an invite link to play a friend online, pass one phone back and forth, or practice against a robot opponent that adapts to your level.\n\nEvery player has a hand-drawn Humation avatar built with humation-swift. You design it during onboarding, and it appears on the home screen and in the row of friends you played recently, next to your opponent during a match, on the shareable result card with the winner's crown, and in the friends list and pair history.",
  "url": "https://dopa2.com",
  "category": "games",
  "platforms": [
    "ios"
  ],
  "pricing": "freemium",
  "humation": {
    "packages": [
      "humation-swift"
    ],
    "usage": "Player avatars on the home screen and recent-friends row, in the in-match header, on the result card, and in the friends list and pair history"
  },
  "developer": {
    "name": "Day1",
    "github": "endo-yusuke",
    "url": "https://dopa2.com"
  },
  "icon": "icon.png",
  "screenshots": [
    {
      "file": "screenshots/01-home.png",
      "alt": "The home screen with the player's avatar, a row of recent friends and the game catalog"
    },
    {
      "file": "screenshots/02-tictactoe.png",
      "alt": "A Tic-Tac-Toe match in progress with both players' avatars in the header"
    },
    {
      "file": "screenshots/03-connect4.png",
      "alt": "A Connect 4 match with stacked blue and red pieces and both players' avatars"
    },
    {
      "file": "screenshots/04-quoridor.png",
      "alt": "A Quoridor match with walls on the board and both players' avatars in the header"
    },
    {
      "file": "screenshots/05-word.png",
      "alt": "A Word & English match with the guess grid, keyboard and both players' avatars"
    }
  ],
  "links": {
    "appStore": "https://apps.apple.com/app/id6787054273",
    "discord": "https://discord.gg/tq8J2qbxSQ"
  },
  "i18n": {
    "ja": {
      "tagline": "友だちとサクッと対戦できる 2 人用ボードゲーム",
      "description": "DopaDopa は、短時間で遊べる 2 人用ボードゲームを集めた iPhone アプリです。三目並べ、四目並べ、コリドール、ヘックス、ヒット&ブロー、ヨット、ヘア&ハウンズ、そしてワードゲームを収録。6 桁のルームコードや招待リンクを送って友だちとオンラインで対戦したり、1 台の iPhone を交互に持って遊んだり、こちらの腕前に合わせてくれるロボット相手に練習したりできます。\n\nプレイヤーはみんな、humation-swift で描かれた手描きの Humation アバターを持っています。最初のセットアップで自分のアバターを作ると、ホーム画面や最近遊んだ友だちの一覧、対戦中の相手の隣、勝者の王冠が付いたシェア用の結果カード、フレンドリストや対戦履歴に登場します。",
      "usage": "ホーム画面と最近遊んだ友だちの一覧、対戦中のヘッダー、結果カード、フレンドリスト、対戦履歴",
      "screenshots": [
        {
          "file": "screenshots/01-home.png",
          "alt": "自分のアバター、最近遊んだ友だち、ゲーム一覧が並ぶホーム画面"
        },
        {
          "file": "screenshots/02-tictactoe.png",
          "alt": "ヘッダーに 2 人のアバターが表示された三目並べの対戦画面"
        },
        {
          "file": "screenshots/03-connect4.png",
          "alt": "青と赤のコマが積み上がった四目並べの対戦画面と、2 人のアバター"
        },
        {
          "file": "screenshots/04-quoridor.png",
          "alt": "盤上に壁が置かれたコリドールの対戦画面と、ヘッダーの 2 人のアバター"
        },
        {
          "file": "screenshots/05-word.png",
          "alt": "入力グリッドとキーボード、2 人のアバターが並ぶ Word & English の対戦画面"
        }
      ]
    }
  },
  "addedAt": "2026-09-03"
}
